{
  "v": "ACDCCAACAAJSONAAKj.",
  "t": "acm",
  "d": "EKpLN9pyIejZqG-czzBj43piNKdU0anB6oey1eOrzQcD",
  "u": "0AByZWNlaXB0LXRvcC1zYWx0",
  "i": "ENgysJvYdkzp2mesa2zDaBr8e2wZqqQrF9xeHeixWsR5",
  "rd": "EGYKsxMQQkBDYUolFsG-pYJhDnu_4K9H7OJGUkyQGoIa",
  "s": "EHgmOzuf8cbn8ApkJthSRpIbHPVRE66EIfbOm7Detc3g",
  "a": {
    "d": "EFfhRlrvTnRHpbzg507wUiLQWKE3xpefJvvAmXi-1Gzm",
    "u": "0AByZWNlaXB0LWF0dHItc2x0",
    "i": "EBf8rZ_yfFlNFfoMCVfiQda2UNBWkUXFlfVn73wY5Ly5",
    "election": "UT-SL-2026-11-03-GEN",
    "packet": "PKT-000417",
    "request": "ECV1VRljRsMcgfE4wqhb0mf75-ZK-8cB5aO60KCF-rvQ",
    "exchange": "EHCpEAOOjLXSrVLub3vl2DGPCxk0_2RzCSPW9z6YD9az",
    "heldAt": "2026-11-17T15:04:05+00:00",
    "basis": "EN0JtdzBmFuTUzyJG9CXZhtdu-bW0V6L95bsVBzi-cY-"
  }
}
